title,doi
Synthesis gas and H2 production by chemical looping reforming using bio-oil from fast pyrolysis of wood as raw material,10.1016/j.cej.2021.133376
Hydrogen and syngas production through dynamic chemical looping reforming-decomposition of methane,10.1016/j.ijhydene.2022.01.066
Deoxygenation-enhanced chemical looping gasification: a new pathway to produce hydrogen from biomass†,10.1039/d1gc04733g
Hydrogen-enriched syngas production by lignite chemical looping gasification with composite oxygen carriers of phosphogypsum and steel slag,10.1016/j.energy.2021.122927
A novel hydrogen production system based on the three-step coal gasification technology thermally coupled with the chemical looping combustion process,10.1016/j.ijhydene.2021.12.050
Cellulose gasification with Ca–Fe oxygen carrier in chemical-looping process,10.1016/j.energy.2021.122204
Study on Hydrogen Production of ZhunDong Coal Using Chemical Looping with Cu-Fe as Oxygen Carrier,10.1080/00102202.2021.1920582
A novel system of biomass for the generation of inherently separated syngas by combining chemical looping CO2-gasification and steam reforming process,10.1016/j.enconman.2021.114876
Gasification of municipal solid waste (MSW) as a cleaner final disposal route: A mini-review,10.1016/j.biortech.2021.126217
Chemical looping reforming (CLR) for syngas production,10.1016/B978-0-323-91871-8.00017-9
Hydrogen Production,10.1007/978-3-030-72579-2_29
Techno-enviro-economic analysis of integrated direct chemical looping coal-based power generation and methanol synthesis using renewable hydrogen,10.1016/j.jcou.2021.101768
Hydrogen-rich syngas production from chemical looping gasification of lignite by using NiFe2O4 and CuFe2O4 as oxygen carriers,10.1016/j.fuel.2021.121269
Pt–calcium cobaltate enables sorption-enhanced steam reforming of glycerol coupled with chemical-looping CH4 combustion,10.1002/aic.17383
Comparative thermodynamic and techno-economic assessment of green methanol production from biomass through direct chemical looping processes,10.1016/j.jclepro.2021.129023
Conceptual design and comprehensive analysis for novel municipal sludge gasification-based hydrogen production via plasma gasifier,10.1016/j.enconman.2021.114635
Nitrogen migration in coal during the chemical looping gasification reduction process using a nickel-based oxygen carrier,10.1016/j.jaap.2021.105331
CO2 capturing methods: Chemical looping combustion (CLC) as a promising technique,10.1016/j.scitotenv.2021.147850
"Thermodynamic analysis of hydrogen production from carbide slag used as oxygen carrier, hydrogen carrier and in-situ carbon capture agent during the gasification of lignite",10.1016/j.enconman.2021.114456
A techno-economic analysis of solar catalytic chemical looping biomass refinery for sustainable production of high purity hydrogen,10.1016/j.enconman.2021.114341
Techno-Economic Assessment of IGCC Power Plants Using Gas Switching Technology to Minimize the Energy Penalty of CO2 Capture,10.3390/cleantechnol3030036
Performance of solid oxide fuel cell with chemical looping gasification products as fuel,10.1016/j.ijhydene.2021.06.162
Energy and economic analysis of a hydrogen and ammonia co-generation system based on double chemical looping,10.1016/j.cjche.2020.10.007
Energy consumption and greenhouse gas emissions of shale gas chemical looping reforming process integrated with coal gasification for methanol production,10.1016/j.applthermaleng.2021.116990
Chemical looping gasification of torrefied woodchips in a bubbling fluidized bed test rig using iron-based oxygen carriers,10.1016/j.renene.2021.03.006
Efficient strategy of utilizing alkaline liquid waste boosting biomass chemical looping gasification to produce hydrogen,10.1016/j.fuproc.2021.106818
Characterization of copper (II) chemical forms and heavy metal distribution in chemical looping gasification of municipal solid waste,10.1016/j.joei.2021.03.005
Alkali metal modified iron-nickel oxygen carrier to produce hydrogen-rich synthesis gas by chemical looping gasification with pine sawdust,10.1002/er.6131
Energy quality factor and exergy destruction processes analysis for chemical looping hydrogen generation by coal,10.1002/er.6180
Catalyzed ethanol chemical looping gasification mechanism on the perfect and reduced fe2o3 surfaces,10.3390/en14061663
Chemical looping gasification of biochar to produce hydrogen-rich syngas using Fe/Ca-based oxygen carrier prepared by coprecipitation,10.1016/j.joei.2020.12.006
Syngas preparation by NiO–CaSO4-based oxygen carrier from chemical looping gasification technology,10.1016/j.joei.2020.09.003
"Hydrogen Production from Low-Grade Agricultural Waste: Integrated Drying, Gasification, and Chemical Looping",10.3303/CET2188039
Chemical looping conversion of biomass and biomass-derived feedstocks,10.1016/B978-0-12-821601-9.00004-2
High-quality syngas production from biomass driven by chemical looping on a PY-GA coupled reactor,10.1016/j.energy.2020.118846
Recent advances in oxygen carriers for chemical looping combustion of coal,10.13226/j.issn.1006-6772.CCUS20093002
