title,doi
Towards clean palm oil processing: Integrated ammonia production from empty fruit bunch and palm oil effluent,10.1016/j.jclepro.2019.117680
Chemical looping gasification of coal using calcium ferrites as oxygen carrier,10.1016/j.fuproc.2019.04.009
Research progress on biomass chemical-looping conversion technology,10.11949/0438-1157.20190309
Reaction schemes of barium ferrite in biomass chemical looping gasification for hydrogen-enriched syngas generation via an outer-inner looping redox reaction mechanism,10.1016/j.enconman.2019.03.084
Microalgae-based coproduction of ammonia and power employing chemical looping process,10.1016/j.cherd.2019.04.013
Biomass Gasification Integrated with Chemical Looping System for Hydrogen and Power. Coproduction Process – Thermodynamic and Techno-Economic Assessment,10.1002/ceat.201900130
Syngas production from biomass using Fe-based oxygen carrier: Optimization,10.1016/j.biortech.2019.02.012
Syngas production and trace element emissions from microwave-assisted chemical looping gasification of heavy metal hyperaccumulators,10.1016/j.scitotenv.2018.12.176
Enhanced chemical looping hydrogen production based on biomass ash-promoted iron ore oxygen carrier,10.1016/j.cej.2018.11.226
"Identifying the roles of MFe 2 O 4 (M=Cu, Ba, Ni, and Co) in the chemical looping reforming of char, pyrolysis gas and tar resulting from biomass pyrolysis",10.1016/j.ijhydene.2018.12.216
Using chemical looping gasification with Fe 2 O 3 /Al 2 O 3 oxygen carrier to produce syngas (H 2 +CO) from rice straw,10.1016/j.ijhydene.2018.06.147
"Solar-Wind-Bio Ecosystem for Biomass Cascade Utilization with Multigeneration of Formic Acid, Hydrogen, and Graphene",10.1021/acssuschemeng.8b05546
Hydrogen production from the thermochemical conversion of biomass: Issues and challenges,10.1039/c8se00535d
Chemical looping hydrogen production with modified iron ore as oxygen carriers using biomass pyrolysis gas as fuel,10.1039/c9ra08936e
Dual-stage chemical looping of microalgae for methanol production with negative-carbon emission,10.1016/j.egypro.2019.01.218
Efficient black liquor conversion to power and H2 by adopting negative emission technology,10.1016/j.egypro.2019.01.087
Chemical looping dry reforming of benzene as a gasification tar model compound with Ni- and Fe-based oxygen carriers in a fluidized bed reactor,10.1016/j.ijhydene.2018.08.103
Hydrogen-Rich Syngas Production from Chemical Looping Gasification of Biomass Char with CaMn1- xFexO3,10.1021/acs.energyfuels.8b01836
Performance of NiFe2O4 oxygen carrier in hydrogen production by chemical looping steam reforming,10.16606/j.cnki.issn0253-4320.2018.09.021
Life cycle assessment of hydrogen production via iron-based chemical-looping process using non-aqueous phase bio-oil as fuel,10.1016/j.ijggc.2018.06.020
Syngas production by chemical-looping gasification of wheat straw with Fe-based oxygen carrier,10.1016/j.biortech.2018.02.064
Exploring novel hydrogen production processes by integration of steam methane reforming with chemical-looping combustion (CLC-SMR) and oxygen carrier aided combustion (OCAC-SMR),10.1016/j.ijggc.2018.01.008
Assessment of a novel biomass-coal gasification-based system for hydrogen and power co-generation integrated with chemical looping technology,
Analysis of syngas production via sorption enhanced chemical looping biomass gasification,
"Hydrogen production from biomass using iron-based chemical looping technology: Validation, optimization, and efficiency",10.1016/j.cej.2017.12.121
Chemical-looping technologies using circulating fluidized bed systems: Status of development,10.1016/j.fuproc.2017.11.016
Hydrogen from Pyrolysis Oil by Chemical Looping of a Sol–Gel-Prepared Iron(III) Oxide on Magnesium Aluminate as Oxygen Carrier,10.1002/ente.201700398
Thermodynamic analysis of hydrogen-enriched syngas generation coupled with in situ CO2 capture using chemical looping gasification method,10.1007/s10973-017-6596-6
Simulation on hydrogen production from biomass with CaO-based chemical looping gasification,
Chemical Looping and Plasma Technologies for Gasification of Coal and Biomass,10.1007/978-981-10-7335-9_20
CaO-based chemical looping gasification of biomass for the production of hydrogen-enriched gas and CO2 negative emissions: A review,10.1615/InterJEnerCleanEnv.2018025185
Efficient black liquor conversion to power and H 2 based on process integration and exergy recovery,10.1016/j.egypro.2018.09.181
